{
  "schema": 1,
  "repo": "AustineLomocso/reprise-demo-shop",
  "issue": 4,
  "title": "Ordered ten mugs, got charged full price",
  "url": "https://github.com/AustineLomocso/reprise-demo-shop/issues/4",
  "provider": "claude",
  "state": "DUPLICATE",
  "created_at": "2026-09-23T08:40:00Z",
  "updated_at": "2026-09-23T08:42:05Z",
  "triage_runs": 1,
  "auto_retriage_count": 0,
  "triage": {
    "verdict": "DUPLICATE",
    "started_at": "2026-09-23T08:40:20Z",
    "finished_at": "2026-09-23T08:42:05Z",
    "duration_ms": 105000,
    "fingerprint": {
      "component": "pricing",
      "functions": [
        "applyBulkDiscount"
      ],
      "symptom": "no bulk price for ten coffee mugs, full price charged",
      "trigger": "order of exactly 10 units of the mug sku",
      "expected": "bulk price for ten units",
      "actual": "paid the full 2500.00",
      "error_signature": ""
    },
    "duplicate": {
      "of": 1,
      "score": 0.6945701357466062,
      "fields": {
        "component": 1,
        "functions": 1,
        "symptom": 0.07692307692307693,
        "trigger": 0.5,
        "error_signature": null
      },
      "reason": "Both reports describe an order of exactly ten units of one product that got no bulk discount; #1 traces it to the > comparison in applyBulkDiscount.",
      "behaviour_check": "FAIL_MATCH"
    },
    "question": "",
    "baseline_suite": {
      "sha": "877a0e6218bea4d44451193d5436dcb18faa61cb",
      "passed": 12,
      "failed": 0
    },
    "repro": null,
    "bisect": null,
    "root_cause": null
  },
  "cost": {
    "bobcoins_total": 0,
    "by_stage": {
      "intake": 0,
      "dedupe": 0,
      "repro": 0,
      "rootcause": 0,
      "fix": 0
    },
    "bob_tasks": [
      {
        "stage": "intake",
        "task_id": "msg_sample_f35ba88f4ede515acb0a",
        "session_costs": 0,
        "duration_ms": 17000,
        "total_tokens": 5380,
        "input_tokens": 5010,
        "output_tokens": 370,
        "tool_calls": 4
      },
      {
        "stage": "dedupe",
        "task_id": "msg_sample_152281329643e68a14de",
        "session_costs": 0,
        "duration_ms": 12000,
        "total_tokens": 7580,
        "input_tokens": 7400,
        "output_tokens": 180,
        "tool_calls": 3
      }
    ]
  },
  "events": [
    {
      "at": "2026-09-23T08:40:20Z",
      "type": "triage.started",
      "detail": "Maintainer added the reprise label."
    },
    {
      "at": "2026-09-23T08:42:05Z",
      "type": "triage.verdict",
      "detail": "Duplicate of #1, match score 0.69; the reproduction test from #1 still fails on the current code."
    }
  ],
  "resolution_note": ""
}
