{
  "schema": 1,
  "repo": "AustineLomocso/reprise-demo-shop",
  "issue": 9,
  "title": "Two-item order charged the shipping fee twice",
  "url": "https://github.com/AustineLomocso/reprise-demo-shop/issues/9",
  "provider": "claude",
  "state": "CONFIRMED",
  "created_at": "2026-09-24T02:15:00Z",
  "updated_at": "2026-09-24T02:21:48Z",
  "triage_runs": 1,
  "auto_retriage_count": 0,
  "triage": {
    "verdict": "CONFIRMED",
    "started_at": "2026-09-24T02:15:30Z",
    "finished_at": "2026-09-24T02:21:48Z",
    "duration_ms": 378000,
    "fingerprint": {
      "component": "cart",
      "functions": [
        "checkout",
        "shippingFee"
      ],
      "symptom": "flat shipping fee added once per line instead of once per order",
      "trigger": "checkout of a cart with two different products under the free shipping minimum",
      "expected": "one 99.00 shipping fee",
      "actual": "two 99.00 shipping fees",
      "error_signature": ""
    },
    "duplicate": {
      "of": null,
      "score": null,
      "fields": {},
      "reason": "",
      "behaviour_check": null
    },
    "question": "",
    "baseline_suite": {
      "sha": "877a0e6218bea4d44451193d5436dcb18faa61cb",
      "passed": 12,
      "failed": 0
    },
    "repro": {
      "test_file": "test/reprise/issue-9.test.js",
      "test_sha256": "b4cadd906aca52556df4054d30ea78634d5f1df2fbd12a059f472f46df3beeee",
      "branch": "reprise/repro-9",
      "signature": {
        "kind": "assertion_message",
        "pattern": "139800 !== 129900"
      },
      "attempts": 1,
      "scope_violations": [],
      "trials": 20,
      "failed": 20,
      "invalid": 0,
      "sequence": "FFFFFFFFFFFFFFFFFFFF",
      "rate": 1,
      "wilson_low": 0.8388748419471806,
      "wilson_high": 1
    },
    "bisect": {
      "status": "found",
      "good_sha": "6953d1a5456b05eddf48bb7aad0ffbb15fa2a940",
      "first_bad_sha": "0465dd36d17bc6b255c58168945ae80a42d4192c",
      "subject": "feat: price each cart line separately",
      "author": "demo-shop maintainer",
      "date": "2026-09-23T15:44:00Z",
      "url": "https://github.com/AustineLomocso/reprise-demo-shop/commit/0465dd36d17bc6b255c58168945ae80a42d4192c",
      "reason": ""
    },
    "root_cause": {
      "summary": "checkout calls shippingFee() inside the per-line loop, so a cart with two lines pays the flat fee twice.",
      "locations": [
        {
          "file": "src/cart.js",
          "start_line": 21,
          "end_line": 29,
          "reason": "shipping is added inside the loop over lines"
        }
      ],
      "fix_direction": "Add the shipping fee once, after the loop, based on the order subtotal.",
      "confidence": "high",
      "ide_prompt": "Fix GitHub issue #9 in this repository.\nReproduction test: test/reprise/issue-9.test.js (get it with: git checkout origin/reprise/repro-9 -- test/reprise/issue-9.test.js).\nRun it with: node --test --test-reporter=junit --test-reporter-destination=/out/junit.xml test/reprise/issue-9.test.js. It currently fails with: Expected values to be strictly equal: 139800 !== 129900\nLikely cause: checkout calls shippingFee() inside the per-line loop, so a cart with two lines pays the flat fee twice.\nLocations: src/cart.js lines 21–29\nIntroduced in 0465dd3 (feat: price each cart line separately).\nRules: do not modify test/reprise/issue-9.test.js; keep the change minimal; run the full suite with node --test --test-reporter=junit --test-reporter-destination=/out/junit.xml test/ before finishing; open a PR whose description contains \"Fixes #9\"."
    }
  },
  "cost": {
    "bobcoins_total": 0,
    "by_stage": {
      "intake": 0,
      "dedupe": 0,
      "repro": 0,
      "rootcause": 0,
      "fix": 0
    },
    "bob_tasks": [
      {
        "stage": "intake",
        "task_id": "msg_sample_ae84616ef9b12425c50c",
        "session_costs": 0,
        "duration_ms": 20000,
        "total_tokens": 6770,
        "input_tokens": 6340,
        "output_tokens": 430,
        "tool_calls": 4
      },
      {
        "stage": "repro",
        "task_id": "msg_sample_1f805943efaa05a7a605",
        "session_costs": 0,
        "duration_ms": 88000,
        "total_tokens": 18740,
        "input_tokens": 17200,
        "output_tokens": 1540,
        "tool_calls": 8
      },
      {
        "stage": "rootcause",
        "task_id": "msg_sample_90f2a2044bcb79a8f06c",
        "session_costs": 0,
        "duration_ms": 39000,
        "total_tokens": 14290,
        "input_tokens": 13600,
        "output_tokens": 690,
        "tool_calls": 6
      }
    ]
  },
  "events": [
    {
      "at": "2026-09-24T02:15:30Z",
      "type": "triage.started",
      "detail": "Opened by a collaborator."
    },
    {
      "at": "2026-09-24T02:20:55Z",
      "type": "bisect.done",
      "detail": "First bad commit 0465dd3: feat: price each cart line separately"
    },
    {
      "at": "2026-09-24T02:21:30Z",
      "type": "rootcause.done",
      "detail": "High confidence: src/cart.js lines 21–29."
    },
    {
      "at": "2026-09-24T02:21:48Z",
      "type": "triage.verdict",
      "detail": "Reproduced in 20 of 20 runs."
    }
  ],
  "resolution_note": ""
}
